{
  "$schema": "http://json-schema.org/draft-07/schema#",
  "title": "Pinake Manifest",
  "type": "object",
  "additionalProperties": false,
  "required": [
    "version",
    "storage",
    "project",
    "modules",
    "documents"
  ],
  "properties": {
    "version": {
      "type": "number"
    },
    "storage": {
      "type": "object",
      "additionalProperties": false,
      "required": [
        "root",
        "hiddenFromExplorer"
      ],
      "properties": {
        "root": {
          "type": "string",
          "minLength": 1
        },
        "hiddenFromExplorer": {
          "type": "boolean"
        }
      }
    },
    "project": {
      "type": "object",
      "additionalProperties": false,
      "required": [
        "name",
        "documentationType",
        "audience",
        "template"
      ],
      "properties": {
        "name": {
          "type": "string",
          "minLength": 1
        },
        "documentationType": {
          "type": "string",
          "minLength": 1
        },
        "audience": {
          "type": "array",
          "items": {
            "type": "string"
          }
        },
        "template": {
          "type": "string",
          "minLength": 1
        }
      }
    },
    "modules": {
      "type": "object",
      "additionalProperties": {
        "type": "boolean"
      }
    },
    "documents": {
      "type": "array",
      "items": {
        "type": "object",
        "additionalProperties": false,
        "required": [
          "id",
          "title",
          "path",
          "type",
          "status",
          "order"
        ],
        "properties": {
          "id": {
            "type": "string",
            "minLength": 1
          },
          "title": {
            "type": "string",
            "minLength": 1
          },
          "path": {
            "type": "string",
            "minLength": 1,
            "not": {
              "pattern": "^/|(^|/)\\.\\.(/|$)"
            }
          },
          "type": {
            "type": "string",
            "enum": [
              "overview",
              "tutorial",
              "how-to",
              "reference",
              "explanation",
              "architecture",
              "adr",
              "runbook",
              "changelog",
              "roadmap",
              "glossary",
              "troubleshooting",
              "testing",
              "process"
            ]
          },
          "status": {
            "type": "string",
            "enum": [
              "draft",
              "in-review",
              "stable",
              "deprecated"
            ]
          },
          "order": {
            "type": "number"
          }
        }
      }
    }
  }
}
